CriterionID,ShortLabel,Section,Level0,Level1,Level2,Level3,Level4,Level5
S1,Career Path Structure,Career & CPD,No career stages or progression pathway defined for teachers,Generic promotion levels exist but not based on professional competence,Some progression levels defined but not aligned to the 4-stage continental model,"Four stages mentioned (Beginner, Proficient, Expert, Distinguished) but lack clear descriptors or requirements",Four stages defined with competence descriptors for each stage but missing progression criteria,"Fully defined 4-stage career path (Beginner→Proficient→Expert→Distinguished) with detailed competences, CPD requirements, and progression criteria for each stage"
S2,Teacher Professional Standards (5 Domains),Professional Standards,No professional standards or competences defined for teachers,Generic teaching guidelines exist but not structured as professional standards,"Some professional domains covered but incomplete (missing 2-3 domains from the 5-domain framework)","All 5 domains mentioned (Knowledge, Skills, Values, Partnerships, Leadership) but lack detailed competences/descriptors",All 5 domains with substantial competences defined but partial alignment to AFSCTP,"Full alignment: All 5 domains (Professional Knowledge, Skills, Values/Attributes, Partnerships, Leadership) with comprehensive competences matching AFSCTP"
S3,School Leadership Standards,School Leadership,No standards defined for school leaders/principals,Generic management standards only (administrative focus),Some leadership standards exist but cover fewer than 4 of the 7 key areas,Leadership standards exist but not aligned to the 7-standard continental framework,Substantial alignment with 7 standards but missing detailed competences for career stages,"Full alignment with all 7 leadership standards: Developing Self/Others, Leading Knowledge/Practice, Managing Resources, Promoting Improvement, Generating Resources, Supporting Learners, and Community Engagement"
S4,Competency Assessment Framework,Professional Regulation,No competency assessment or testing mentioned,Informal/self-assessment only with no standardized testing,Assessment exists but not explicitly linked to career stage progression,Competency testing mentioned for some transitions but not standardized across all stages,Structured competency tests for progression but lacking technology-based implementation (CBT),"Comprehensive competency testing for all career transitions (Beginner→Proficient→Expert→Distinguished) using standardized computer-based testing aligned to AFSCTP"
S5,Continental Strategy Alignment,Policy Context,No reference to African Union education strategies or international frameworks,Generic reference to African education without specific strategy alignment,Mentions CESA 16-25 but not integrated into the standards framework,References CESA 16-25 and Agenda 2063 but lacks explicit implementation pathways,Substantial alignment with CESA 16-25 Strategic Objective 1 and continental teacher policies,"Explicit alignment with CESA 16-25, Agenda 2063, SDG4c, and Continental Teacher Mobility Protocol with clear implementation strategies"
